{
  "schema_version": "1.0",
  "study_id": "fictional-a-01-narrative-study",
  "title": {
    "en": "Fictional A-01 narrative motion study",
    "zh": "虚构 A-01 叙事运动研究"
  },
  "interpretation_scope": "media_representation",
  "evidence_state": "proposed",
  "source_record_ids": ["fictional-source-a-01"],
  "visual_cues": [
    {
      "cue_id": "fictional-circulation-cue",
      "cue_type": "circulation",
      "description": "An abstract curatorial cue detached from object operation.",
      "evidence_ids": ["fictional-evidence-a-01"]
    }
  ],
  "safety_constraints": {
    "joined_proxy_only": true,
    "scene_camera_motion_only": true,
    "no_part_motion": true,
    "no_joint_motion": true,
    "no_operational_sequence": true,
    "no_frame_breakdown": true,
    "no_angles_or_speed": true,
    "no_grip_guidance": true
  }
}

